{
  "$schema": "https://json-schema.org/draft/2020-12/schema",
  "$id": "https://retroarchivebox.invalid/schemas/malware-provider-result-v1.json",
  "title": "AVBox malware analysis result",
  "type": "object",
  "required": ["protocol_version", "request_id", "provider_job_id", "input", "profile", "timing", "overall_status", "observations", "provider_warnings"],
  "properties": {
    "protocol_version": {"const": "1"}, "request_id": {"type": "string"}, "provider_job_id": {"type": "string"},
    "input": {"type": "object", "required": ["sha256", "size", "representation"], "properties": {"sha256": {"type": "string", "pattern": "^[0-9a-f]{64}$"}, "size": {"type": "integer", "minimum": 0}, "representation": {"type": "string"}}, "additionalProperties": false},
    "profile": {"type": "object", "required": ["requested_profile", "executed_profile", "analysis_set_id", "analysis_set_version"], "properties": {"requested_profile": {"type": "string"}, "executed_profile": {"type": "string"}, "analysis_set_id": {"type": "string"}, "analysis_set_version": {"type": "string"}}, "additionalProperties": false},
    "timing": {"type": "object", "required": ["submitted", "started", "completed"], "properties": {"submitted": {"type": "string", "format": "date-time"}, "started": {"type": "string", "format": "date-time"}, "completed": {"type": "string", "format": "date-time"}}, "additionalProperties": false},
    "overall_status": {"enum": ["COMPLETE", "COMPLETE_WITH_WARNINGS", "PARTIAL", "FAILED"]},
    "observations": {"type": "array", "maxItems": 256, "items": {"type": "object", "required": ["scanner_id", "scanner_class", "vendor", "product", "coverage", "result", "detections", "warnings", "limitations", "runtime", "adapter"], "properties": {"scanner_id": {"type": "string"}, "scanner_class": {"type": "string"}, "vendor": {"type": "string"}, "product": {"type": "string"}, "product_version": {"type": ["string", "null"]}, "engine_version": {"type": ["string", "null"]}, "definitions_version": {"type": ["string", "null"]}, "definitions_date": {"type": ["string", "null"]}, "definitions_hash": {"type": ["string", "null"]}, "coverage": {"type": "string"}, "result": {"type": "string"}, "detections": {"type": "array", "maxItems": 4096}, "warnings": {"type": "array"}, "limitations": {"type": "array"}, "runtime": {"type": "string"}, "adapter": {"type": "object"}}, "additionalProperties": false}},
    "provider_warnings": {"type": "array", "items": {"type": "string"}}, "instance_id": {"type": "string"}
  },
  "additionalProperties": false
}
