{"protocol_version":"1","request_id":"avreq-11111111111111111111111111111111","provider_job_id":"avbox-job-fixture","input":{"sha256":"aaaaaaaaaaaaaaaaaaaaaaaaaaaaaaaaaaaaaaaaaaaaaaaaaaaaaaaaaaaaaaaa","size":1024,"representation":"adf"},"profile":{"requested_profile":"amiga-historical","executed_profile":"amiga-historical","analysis_set_id":"avbox-set-2026","analysis_set_version":"1"},"timing":{"submitted":"2026-01-01T00:00:00+00:00","started":"2026-01-01T00:00:01+00:00","completed":"2026-01-01T00:00:02+00:00"},"overall_status":"COMPLETE","observations":[{"scanner_id":"virusz","scanner_class":"NATIVE_RETRO","vendor":"VirusZ","product":"VirusZ","product_version":"1","engine_version":"1","definitions_version":"fixture","definitions_date":"2026-01-01T00:00:00+00:00","definitions_hash":"sha256:1111111111111111111111111111111111111111111111111111111111111111","coverage":"NATIVE_MEDIA_SCAN","result":"NOT_DETECTED","detections":[],"warnings":[],"limitations":[],"runtime":"amiga-fixture","adapter":{"id":"avbox-amiga","version":"1"}}],"provider_warnings":[]}
