{"protocol_version":"1","request_id":"avreq-11111111111111111111111111111111","provider_job_id":"avbox-job-fixture","input":{"sha256":"aaaaaaaaaaaaaaaaaaaaaaaaaaaaaaaaaaaaaaaaaaaaaaaaaaaaaaaaaaaaaaaa","size":1024,"representation":"adf"},"profile":{"requested_profile":"retro-standard","executed_profile":"retro-standard","analysis_set_id":"avbox-set-2026","analysis_set_version":"2"},"timing":{"submitted":"2026-01-01T00:00:00+00:00","started":"2026-01-01T00:00:01+00:00","completed":"2026-01-01T00:00:02+00:00"},"overall_status":"COMPLETE","observations":[{"scanner_id":"current","scanner_class":"CURRENT_ISOLATED","vendor":"Fixture","product":"Current AV","coverage":"EXTRACTED_FILES","result":"NOT_DETECTED","detections":[],"warnings":[],"limitations":[],"runtime":"isolated","adapter":{"id":"current","version":"1"}},{"scanner_id":"historical","scanner_class":"NATIVE_RETRO","vendor":"Fixture","product":"Historical AV","coverage":"NATIVE_MEDIA_SCAN","result":"DETECTED","detections":[{"name":"Fixture.Retro.Virus"}],"warnings":[],"limitations":[],"runtime":"retro-vm","adapter":{"id":"historical","version":"1"}}],"provider_warnings":[]}
